Tool,URL,Description,Category,,
Liveuamap,http://liveuamap.com/,Interactive live map of conflict and news events.,News & Event Monitoring,,
Syriancivilwarmap.com,https://syriancivilwarmap.com/,A dedicated live map for the Syrian civil war.,News & Event Monitoring,,
Google Trends,https://trends.google.com/trends/,Analyze the popularity of search queries in Google Search.,News & Event Monitoring,,
Google Alerts,https://www.google.com/alerts,Get email notifications for new results on a topic.,News & Event Monitoring,,
ReliefWeb,https://reliefweb.int/,A humanitarian information service provided by the UN.,News & Event Monitoring,,
Amnesty News,https://www.amnesty.org/en/latest/news/,News and reports from Amnesty International.,News & Event Monitoring,,
NewsBrief,https://emm.newsbrief.eu/NewsBrief/clusteredition/en/latest.html,European Media Monitor news aggregator.,News & Event Monitoring,,
Tails OS,https://tails.boum.org/,"A live operating system that you can start on almost any computer from a USB stick or a DVD, routing all internet traffic through Tor.",OPSEC & Privacy,,
Kodachi Linux,https://www.digi77.com/,"An OS based on Debian that provides a secure, anti-forensic, and anonymous operating system.",OPSEC & Privacy,,
Trace Labs OSINT VM,https://tracelabs.org/initiatives/osint-vm,A specialized Linux VM pre-loaded with OSINT tools.,OPSEC & Privacy,,
The Tor Project,https://www.torproject.org/,"The official source for the Tor Browser, which anonymizes your web traffic using the Tor network.",OPSEC & Privacy,,
ProtonVPN,https://protonvpn.com/,A reputable VPN service with a strong focus on privacy and security.,OPSEC & Privacy,,
WireGuard,https://www.wireguard.com/,"A modern, fast, and secure VPN tunnel.",OPSEC & Privacy,,
Streisand,https://github.com/StreisandEffect/streisand,A script that sets up a new server running a variety of anti-censorship services.,OPSEC & Privacy,,
ProxySite.com,https://www.proxysite.com/,A free web-based proxy service.,OPSEC & Privacy,,
1.1.1.1,https://1.1.1.1/dns/,"A free, privacy-focused DNS resolver from Cloudflare.",OPSEC & Privacy,,
VeraCrypt,https://www.veracrypt.fr/en/Home.html,A powerful open-source tool for on-the-fly disk encryption.,OPSEC & Privacy,,
KeePassXC,https://keepassxc.org/,"An open-source, cross-platform password manager.",OPSEC & Privacy,,
Bitwarden,https://bitwarden.com/,A popular open-source password manager with cloud and self-hosting options.,OPSEC & Privacy,,
Have I Been Pwned: Pwned Passwords,https://haveibeenpwned.com/Passwords,Check if a password has appeared in a data breach.,OPSEC & Privacy,,
DeHashed,https://www.dehashed.com/,A tool to search for your credentials in breached databases.,OPSEC & Privacy,,
DBAN - Darik's Boot And Nuke,https://dban.org/,A tool for securely wiping entire hard drives.,OPSEC & Privacy,,
BleachBit,https://www.bleachbit.org/,A tool to cleaning your system and shredding files.,OPSEC & Privacy,,
pfSense,https://www.pfsense.org/,"A powerful, open-source firewall and router platform.",OPSEC & Privacy,,
Brave Browser,https://brave.com/,A privacy-focused browser with a built-in ad and tracker blocker.,OPSEC & Privacy,,
Firefox,https://www.mozilla.org/nb-NO/,A popular open-source browser with strong privacy features.,OPSEC & Privacy,,
Cover Your Tracks (EFF),https://coveryourtracks.eff.org/,Test your browser's protection against tracking and fingerprinting.,OPSEC & Privacy,,
BrowserLeaks,https://browserleaks.com/,A suite of tests to see what personal data your browser is leaking.,OPSEC & Privacy,,
AmIUnique,https://amiunique.org/,View and compare your browser fingerprint with a large dataset.,OPSEC & Privacy,,
IP/DNS Leak Test,https://ipleak.net/,"A comprehensive tool to check for IP, DNS, and WebRTC leaks.",OPSEC & Privacy,,
Privacy Badger,https://privacybadger.org/,An EFF browser extension that automatically learns to block invisible trackers.,OPSEC & Privacy,,
uBlock Origin,https://github.com/gorhill/uBlock#ublock-origin,"An efficient, wide-spectrum content blocker.",OPSEC & Privacy,,
VirusTotal,https://www.virustotal.com/gui/,"An online service that analyzes files and URLs for viruses, worms, and trojans.",OPSEC & Privacy,,
Hybrid-Analysis,https://www.hybrid-analysis.com/,A free malware analysis service powered by CrowdStrike.,OPSEC & Privacy,,
urlscan.io,https://urlscan.io/,A free service to scan and analyze websites.,OPSEC & Privacy,,
Malwarebytes,https://www.malwarebytes.com/,A popular anti-malware software.,OPSEC & Privacy,,
Messageheader (Google),https://toolbox.googleapps.com/apps/messageheader/,Analyze email headers to trace origin and check for spoofing.,OPSEC & Privacy,,
Jigsaw's Phishing Quiz,https://phishingquiz.withgoogle.com/,A quiz to test your ability to spot phishing emails.,OPSEC & Privacy,,
Oracle VM VirtualBox,https://www.oracle.com/virtualization/virtualbox/,A free and open-source hypervisor for x86 virtualization.,OPSEC & Privacy,,
VMware Workstation Player,https://www.vmware.com/products/workstation-player.html,A free virtualization software for non-commercial use.,OPSEC & Privacy,,
Genymotion,https://www.genymotion.com/,An Android emulator for running Android virtual devices.,OPSEC & Privacy,,
Telegram,https://web.telegram.org/#/login,A popular messaging app with optional end-to-end encrypted chats.,Social Media Intelligence,,
Matrix,https://matrix.org/,"An open network for secure, decentralized communication.",OPSEC & Privacy,,
Keybase,https://keybase.io/,A service for managing online identities and encrypted communication.,OPSEC & Privacy,,
SecureDrop,https://securedrop.org/,An open-source whistleblower submission system.,OPSEC & Privacy,,
Gpg4win,https://gpg4win.org/index.html,A software suite for email and file encryption on Windows using PGP.,OPSEC & Privacy,,
PrivacyTools.io,https://www.privacytools.io/,"Provides services, tools, and knowledge to protect your privacy against global mass surveillance.",OPSEC & Privacy,,
Surveillance Self-Defense (EFF),https://ssd.eff.org/en,The Electronic Frontier Foundation's guide to defending yourself from surveillance.,OPSEC & Privacy,,
Security in a Box,https://securityinabox.org/en/,A guide to digital security for activists and human rights defenders.,OPSEC & Privacy,,
Social-Engineer.org,https://www.social-engineer.org/,"A site focused on the art and science of ""human hacking."".",OPSEC & Privacy,,
Blacklight Real-Time Website Privacy Inspector,https://themarkup.org/series/blacklight,A tool that scans a website for user-tracking technologies.,OPSEC & Privacy,,
Bellingcat's OSINT Toolkit,https://docs.google.com/document/d/1BfLPJpRtyq4RFtHJoNpvWQjmGnyVkfE2HYoICKOGguA/edit,A curated list of tools and resources.,Verification & Resources,,
OSINT Framework,https://osintframework.com/,A framework for organizing OSINT tools by category.,Verification & Resources,,
Verification Handbook,http://verificationhandbook.com/,The definitive guide for verifying digital content for emergency coverage.,Verification & Resources,,
Sector035,https://sector035.nl/articles/category:week-in-osint,"High-quality articles and the ""Week in OSINT"" newsletter.",News & Event Monitoring,,
NixIntel,https://nixintel.info/,A blog with in-depth OSINT tutorials and techniques.,Dark Web & Anonymity,,
OSINTCurious,https://osintcurio.us/,A blog and project dedicated to OSINT learning.,Verification & Resources,,
i-intelligence OSINT Handbook,https://i-intelligence.eu/uploads/public-documents/OSINT_Handbook_2020.pdf,A comprehensive PDF handbook on OSINT methods.,Verification & Resources,,
Web Archive,https://archive.org/web/,The Wayback Machine for viewing historical versions of websites.,Dark Web & Anonymity,,
Archive.today,http://archive.today/,An archive site that captures snapshots of web pages.,Verification & Resources,,
Google Images,https://images.google.com/,Reverse image search.,Image & Video Analysis,,
Yandex Images,https://yandex.com/images/,"Excellent reverse image search, especially for faces and locations.",Geospatial & Maps,,
Baidu Images,https://image.baidu.com/,Chinese reverse image search engine.,Image & Video Analysis,,
Bing Images,https://www.bing.com/?scope=images&nr=1&FORM=NOFORM,Reverse image search from Microsoft.,Image & Video Analysis,,
TinEye,https://www.tineye.com/,"The original reverse image search, good for finding a source and modifications.",Image & Video Analysis,,
Google Lens,https://lens.google.com/,Uses AI to identify objects and text in images.,Image & Video Analysis,,
Pimeyes,https://pimeyes.com/en/,A powerful facial recognition search engine.,Image & Video Analysis,,
Jeffrey Friedl's Image Metadata Viewer,http://exif.regex.info/exif.cgi,In-depth EXIF and metadata viewer.,Image & Video Analysis,,
FotoForensics,http://fotoforensics.com/,Provides Error Level Analysis (ELA) to detect image manipulation.,Image & Video Analysis,,
Forensically,https://2a.ch/photo-forensics/,A set of free tools for digital image forensics.,Image & Video Analysis,,
InVID Video Verification Plugin,https://www.invid-project.eu/tools-and-services/invid-verification-plugin/,A browser extension for analyzing and verifying video content.,Image & Video Analysis,,
Amnesty YouTube DataViewer,http://citizenevidence.amnestyusa.org/,Extracts metadata and thumbnails from YouTube videos for verification.,Image & Video Analysis,,
WatchFrameByFrame,http://www.watchframebyframe.com/,Analyze YouTube videos frame by frame.,Image & Video Analysis,,
FDownloader,https://fdownloader.net/en,Download videos from Facebook.,Social Media Intelligence,,
Flightradar24,https://www.flightradar24.com/51.47,7.14/7,Geospatial & Maps,,
FlightAware,http://uk.flightaware.com/,Flight tracking with historical data and alerts.,Geospatial & Maps,,
ADS-B Exchange,https://globe.adsbexchange.com/,"Unfiltered flight data, including military and private aircraft.",Geospatial & Maps,,
The OpenSky Network,https://opensky-network.org/network/explorer,Global community-based receiver network for flight data.,Geospatial & Maps,,
VesselFinder,https://www.vesselfinder.com/,Real-time ship tracking data with vessel information.,Geospatial & Maps,,
MarineTraffic,http://www.marinetraffic.com/en/ais/home/centerx:-12.0/centery:25.0/zoom:4,Live maritime vessel tracking and port data.,Geospatial & Maps,,
myShipTracking,https://www.myshiptracking.com/,Live AIS vessel tracking.,Geospatial & Maps,,
FleetMon,https://www.fleetmon.com/,"Vessel tracking, port information, and maritime news.",News & Event Monitoring,,
OpenRailwayMap,http://www.openrailwaymap.org/,A detailed map of the world's railway infrastructure.,Geospatial & Maps,,
Tails,https://tails.boum.org/,Tails OS,OPSEC & Privacy,,
USB Pen Drive Linux,https://www.pendrivelinux.com/,OS USB Installer,OPSEC & Privacy,,
WebOProxy,https://weboproxy.com/,WebOProxy,OPSEC & Privacy,,
Proxifier,https://www.proxifier.com/,Proxifier,OPSEC & Privacy,,
Free Web Proxy,https://www.hidemyass.com/proxy,Proxy,OPSEC & Privacy,,
Privoxy,https://www.privoxy.org/,Proxy,OPSEC & Privacy,,
Technitium MAC Address Changer,https://technitium.com/tmac/,MAC Address Changer,OPSEC & Privacy,,
Proton Drive,https://protonmail.com/blog/proton-drive-early-access/,Encrypted cloud storage is available in beta,OPSEC & Privacy,,
SpiderOak One Backup,https://spideroak.com/one/,SpiderOak One Backup | SpiderOak,OPSEC & Privacy,,
Dashlane,https://www.dashlane.com/lp/neverforget-cj,Password Manager,OPSEC & Privacy,,
LastPass,https://www.lastpass.com/security/staying-secure-online,Password Manager,OPSEC & Privacy,,
KeePass,https://keepass.info/,KeePass,OPSEC & Privacy,,
Fileshredder,https://fileshredder.org/,Data Wiping,OPSEC & Privacy,,
Darik's Boot And Nuke,https://dban.org/,Data Wiping,OPSEC & Privacy,,
Eraser,https://eraser.heidi.ie/,Eraser – Secure Erase Files from Hard Drives,OPSEC & Privacy,,
Privacy Test & Analyzer,https://privacy.net/analyzer/,See what information websites know about you,OPSEC & Privacy,,
Qualys BrowserCheck,https://browsercheck.qualys.com/,Qualys BrowserCheck,OPSEC & Privacy,,
Cloudflare Browsing Experience Security Check,https://www.cloudflare.com/nb-no/ssl/encrypted-sni/,Browsing Experience Security Check,OPSEC & Privacy,,
Canvas Fingerprinting Test,https://browserleaks.com/canvas,Canvas Fingerprinting,OPSEC & Privacy,,
Cover Your Tracks,https://coveryourtracks.eff.org/,Cover Your Tracks - Browser tracking and fingerprinting,OPSEC & Privacy,,
IP/DNS Detect,https://ipleak.net/,IP/DNS Detect,OPSEC & Privacy,,
Surveillance Self-Defense,https://ssd.eff.org/en,OPSEC | Privacy Resources,OPSEC & Privacy,,
Riseup Digital Security,https://riseup.net/en/security,OPSEC | Privacy Resources,OPSEC & Privacy,,
F-Secure Free Online Scanner,https://www.f-secure.com/en/home/free-tools/online-scanner,Antivirus And Malware Online scanners,OPSEC & Privacy,,
Jotti's malware scan,https://virusscan.jotti.org/,Antivirus And Malware Online scanners,OPSEC & Privacy,,
PolySwarm,https://polyswarm.network/scan,Antivirus And Malware Online scanners,OPSEC & Privacy,,
GlassWire,https://www.glasswire.com/,GlassWire - Personal Firewall,OPSEC & Privacy,,
BrowserLeaks Test,https://browserleaks.com/,Browser / IP / DNS Leak Test,OPSEC & Privacy,,
Ipv6leak,https://ipv6leak.com/,Browser / IP / DNS Leak Test,OPSEC & Privacy,,
DNS leak test,https://www.dnsleaktest.com/,Browser / IP / DNS Leak Test,OPSEC & Privacy,,
Threat Intelligence Platform,https://threatintelligenceplatform.com/,Website Security,OPSEC & Privacy,,
Safe Browsing site status,https://transparencyreport.google.com/safe-browsing/search?hl=en,Website Security,OPSEC & Privacy,,
ONYPHE,https://www.onyphe.io/,Alternativ Website Security Search,OPSEC & Privacy,,
ThreatMiner,https://www.threatminer.org/,Alternativ Website Security Search,OPSEC & Privacy,,
URLVoid,https://www.urlvoid.com/,Alternativ Website Security Search,OPSEC & Privacy,,
MXtoolbox,https://mxtoolbox.com/,Alternativ Website Security Search,OPSEC & Privacy,,
Checkphish,https://checkphish.ai/,Alternativ Website Security Search,OPSEC & Privacy,,
VM VirtualBox,https://www.oracle.com/virtualization/virtualbox/,hypervisor (Virtial Machine monitor),OPSEC & Privacy,,
VMware - Workstation Player,https://www.vmware.com/products/workstation-player.html,hypervisor (Virtial Machine monitor),OPSEC & Privacy,,
Genymotion – Android Emulator,https://www.genymotion.com/,Android and iOS Emulator,OPSEC & Privacy,,
Bluestacks,https://www.bluestacks.com/,Android and iOS Emulator,OPSEC & Privacy,,
Kodachi The Secure OS,https://www.digi77.com/,OS Systems,OPSEC & Privacy,,
Blacklight - The Markup,https://themarkup.org/series/blacklight,Real-Time Website Privacy Inspector,OPSEC & Privacy,,
Mozilla - Firefox,https://www.mozilla.org/nb-NO/,Internet Browsers,OPSEC & Privacy,,
Duck Duck Go,https://duckduckgo.com/,Private Search Engine,OPSEC & Privacy,,
Startpage,https://startpage.com/,Private Search Engine,OPSEC & Privacy,,
HTTPS Everywhere,https://www.eff.org/httpss-everywhere,Firefox Addons,OPSEC & Privacy,,
uBlock,https://github.com/gorhill/uBlock#ublock-origin,Firefox Addons,OPSEC & Privacy,,
Crxcavator.io,https://crxcavator.io/,Chrome Extension ID scan,OPSEC & Privacy,,
Telegram Web,https://web.telegram.org/#/login,Encrypted Communication,Social Media Intelligence,,
Wickr,https://wickr.com/,The Most Secure Video Conferencing & Collaboration Platform,OPSEC & Privacy,,
Safenote,https://safenote.co/,Secure way to share notes and files,OPSEC & Privacy,,
GPG Suite,https://gpgtools.org/,MAC - Pretty Good Privacy (PGP),OPSEC & Privacy,,
The GNU Privacy Guard,https://gnupg.org/,Pretty Good Privacy (PGP),OPSEC & Privacy,,
mat2,https://0xacab.org/jvoisin/mat2,Remove Meta Data,OPSEC & Privacy,,
Check Short URL,https://checkshorturl.com/,Shorten Links and URL (SECURITY),OPSEC & Privacy,,
unfurl,https://dfir.blog/unfurl/,Short-link Expansion Tools,OPSEC & Privacy,,
Disposable SMS services,https://github.com/AnarchoTechNYC/meta/wiki/Disposable-SMS-services,Online Phone Number / SMS,OPSEC & Privacy,,
Oracle VM VirtualBox,https://www.virtualbox.org/,virtual machine software,OPSEC & Privacy,,
Secure Messaging Apps Comparison,https://www.securemessagingapps.com/,Chart Secure Messaging Apps,OPSEC & Privacy,,
Viewdns Whois,https://viewdns.info/whois/,Whois Search,Domain & IP Intelligence,,
Reverse Whois Lookup,https://viewdns.info/reversewhois/,Whois Search,Domain & IP Intelligence,,
Whois Domain Lookup,https://www.whois.com/whois/,Whois Search,Domain & IP Intelligence,,
Whois. DomainTools,https://whois.domaintools.com/,Whois Search,Domain & IP Intelligence,,
Reverse IP Lookup,https://viewdns.info/reverseip/,Reverse IP Search,Domain & IP Intelligence,,
Viewdns Port Scanner,https://viewdns.info/portscan/,DNS Port Scanner,Domain & IP Intelligence,,
IP History,https://viewdns.info/iphistory/,DNS IP History,Domain & IP Intelligence,,
DNS History,https://completedns.com/dns-history/,DNS IP History,Domain & IP Intelligence,,
Iplocation,https://iplocation.com/,IP Addresses,Geospatial & Maps,,
BGPview,https://bgpview.io/,IP Addresses,Domain & IP Intelligence,,
IPLocationTools,https://www.ipaddressguide.com/,IP Addresses,Geospatial & Maps,,
IP2Location (Free Demo Mode),https://www.ip2location.com/demo,IP Addresses,Geospatial & Maps,,
IP Locator,https://www.ipfingerprints.com/,IP Addresses,Domain & IP Intelligence,,
IP Address API and Data Solutions,https://ipinfo.io/,IP Addresses,Domain & IP Intelligence,,
IP Location Finder,https://www.iplocation.net/,IP Addresses,Geospatial & Maps,,
AbuseIPDB,https://www.abuseipdb.com/,IP Abuse and Blacklist Check,Domain & IP Intelligence,,
Scamalytics,https://scamalytics.com/,IP Abuse and Blacklist Check,Domain & IP Intelligence,,
Cisco Talos Intelligence Group,https://www.talosintelligence.com/,IP Abuse and Blacklist Check,Domain & IP Intelligence,,
IPVoid - Blacklist Check,https://www.ipvoid.com/ip-blacklist-check/,IP Abuse and Blacklist Check,Domain & IP Intelligence,,
IPSpamList - IP Lookup,https://www.ipspamlist.com/ip-lookup/,IP Abuse and Blacklist Check,Domain & IP Intelligence,,
ApiVoid - IP Reputation/Blacklist Check,https://www.apivoid.com/tools/ip-reputation-check/,IP Abuse and Blacklist Check,Domain & IP Intelligence,,
BrightCloud URL/IP Lookup,https://www.brightcloud.com/tools/url-ip-lookup.php,IP Abuse and Blacklist Check,Domain & IP Intelligence,,
Palo Alto Networks URL filtering,https://urlfiltering.paloaltonetworks.com/,Check / Test Website reputation and categorization,Domain & IP Intelligence,,
Trend Micro Site Safety Center,https://global.sitesafety.trendmicro.com/,Check / Test Website reputation and categorization,Uncategorized,,
McAfee Check Single URL,https://sitelookup.mcafee.com/,Check / Test Website reputation and categorization,Uncategorized,,
Free IPv6 Tools,https://www.ultratools.com/ipv6Tools,IP v6 Tools,Domain & IP Intelligence,,
MAC Address and OUI Lookup,https://aruljohn.com/mac.pl,MAC Address Lookup Tools,Domain & IP Intelligence,,
Viewdns MAC Address Lookup,https://viewdns.info/maclookup/,MAC Address Lookup Tools,Domain & IP Intelligence,,
ICANN Lookup,https://lookup.icann.org/,Domain Names & IP Search Alternitives,Domain & IP Intelligence,,
IPVOID,https://www.ipvoid.com/,Domain Names & IP Search Alternitives,Domain & IP Intelligence,,
DNSlytics,https://dnslytics.com/,Domain Names & IP Search Alternitives,Domain & IP Intelligence,,
SecurityTrails,https://securitytrails.com/,Domain Names & IP Search Alternitives,Domain & IP Intelligence,,
ViewDNS,https://viewdns.info/,Domain Names & IP Search Alternitives,Domain & IP Intelligence,,
Netcraft - DNS,https://searchdns.netcraft.com/,Domain Names & IP Search Alternitives,Domain & IP Intelligence,,
Whoxy,https://www.whoxy.com/,Domain Names & IP Search Alternitives,Domain & IP Intelligence,,
Google cache Search,http://webcache.googleusercontent.com/search?q=cache:Addwebsitehere,Website Visual Search,Uncategorized,,
Archive.vn,https://archive.vn/,Website Visual Search,Uncategorized,,
Internet Archive,https://archive.org/,Website Visual Search,Uncategorized,,
Time Travel,http://timetravel.mementoweb.org/,Website Visual Search,Uncategorized,,
Carbon Dating The Web,http://carbondate.cs.odu.edu/,Website Visual Search,Uncategorized,,
Library of Congress Web Archives,https://webarchive.loc.gov/,Website Visual Search,Uncategorized,,
Urlscan (See Historical Snapshot),https://urlscan.io/,Website Visual Search,Dark Web & Anonymity,,
Follow That Page,https://followthatpage.com/,Website Live Tracking,Uncategorized,,
Visual Ping,https://visualping.io/,Website Live Tracking,Uncategorized,,
SpyOnWeb,https://spyonweb.com/,Domain Analytics,Domain & IP Intelligence,,
Censys,https://search.censys.io/,Domain Analytics,Domain & IP Intelligence,,
Intelligence X,https://intelx.io/,Domain Analytics,Domain & IP Intelligence,,
Analyzeid,https://analyzeid.com/,Domain Analytics,Domain & IP Intelligence,,
The Web Robots Pages,https://www.robotstxt.org/,Domain Analytics,Domain & IP Intelligence,,
Domain IQ,https://www.domainiq.com/,Domain Analytics,Domain & IP Intelligence,,
Find Subdomains Online,https://pentest-tools.com/information-gathering/find-subdomains-of-domain#,Find Subdomains,Domain & IP Intelligence,,
CRT Search Subdomain,https://crt.sh/,Find Subdomains,Domain & IP Intelligence,,
Backlink Checker,https://smallseotools.com/backlink-checker/,Backlink Checker / Link Analysis,Uncategorized,,
Free Link Analysis Tool,https://www.openlinkprofiler.org/,Backlink Checker / Link Analysis,Uncategorized,,
External Link Checker Tool,https://www.crawlcenter.com/external-link-checker,Backlink Checker / Link Analysis,Uncategorized,,
Moz Link Explorer,https://moz.com/link-explorer,Backlink Checker / Link Analysis,Uncategorized,,
Backlinks Checker Tool,http://backlinkwatch.com/index.php,Backlink Checker / Link Analysis,Uncategorized,,
Sites Like,https://www.siteslike.com/,Similar Sites Search,Uncategorized,,
Similar Sites,https://www.similarsites.com/,Similar Sites Search,Uncategorized,,
Similar Site Search,https://www.similarsitesearch.com/,Similar Sites Search,Uncategorized,,
Sitelike,https://www.sitelike.org/,Similar Sites Search,Uncategorized,,
SiteLinks - Similar Webs and BackLinks,https://www.sitelinks.info/,Similar Sites Search,Uncategorized,,
Website Outlook,https://www.websiteoutlook.com/,Search Engine Marketing Tools,Uncategorized,,
SpyFu,https://www.spyfu.com/,Search Engine Marketing Tools,Uncategorized,,
Moonsearch SEO Analysis,http://moonsearch.com/,Search Engine Marketing Tools,Uncategorized,,
Website Informer,https://website.informer.com/,Search Engine Marketing Tools,Uncategorized,,
Alexa - Find Similar Sites,https://www.alexa.com/find-similar-sites,Search Engine Marketing Tools,Uncategorized,,
Alexa - Competitive Analysis,https://www.alexa.com/siteinfo,Search Engine Marketing Tools,Uncategorized,,
SimilarWeb,https://www.similarweb.com/,Search Engine Marketing Tools,Uncategorized,,
Redirect Detective,https://redirectdetective.com/index.html,Redirect Detective,Uncategorized,,
Censys Certificates,https://search.censys.io/,HTTP/SSL Certificates Search,Domain & IP Intelligence,,
Google Transparency Report SSL Certificate,https://transparencyreport.google.com/https/certificates,HTTP/SSL Certificates Search,Domain & IP Intelligence,,
Analyse your HTTP response headers,https://securityheaders.com/,HTTP/SSL Certificates Search,Domain & IP Intelligence,,
CRT - Certificate Search,https://crt.sh/,HTTP/SSL Certificates Search,Domain & IP Intelligence,,
Gnu wget - Website Copier,https://www.gnu.org/software/wget/,Download Websites and Links,Uncategorized,,
BlackWidow – SoftByte Labs,http://softbytelabs.com/wp/blackwidow/,Download Websites and Links,Uncategorized,,
Web Data Extractor,http://www.webextractor.com/wde.htm,Download Websites and Links,Dark Web & Anonymity,,
HTTrack Website Copier,https://www.httrack.com/,Download Websites and Links,Uncategorized,,
Link Extractor,https://www.webtoolhub.com/tn561364-link-extractor.aspx,Download Websites and Links,Dark Web & Anonymity,,
BulkdacheckerFree - URL Extractor,https://www.bulkdachecker.com/url-extractor/,Download Websites and Links,Dark Web & Anonymity,,
DNSlytics Monitoring services,https://dnslytics.com/monitoring,Domain Names Monitoring Services,Domain & IP Intelligence,,
DNS Performance,https://www.dnsperf.com/dns-speed-benchmark,DNS Speedtest,Domain & IP Intelligence,,
GRC's | DNS Nameserver Performance Benchmark,https://www.grc.com/dns/benchmark.htm,DNS Speedtest,Domain & IP Intelligence,,
Network Tools,https://network-tools.com/,Network Tools,Domain & IP Intelligence,,
WiGLE: Wireless Network Mapping,https://wigle.net/index,Network Tools,Domain & IP Intelligence,,
Hurricane Electric BGP Toolkit,https://bgp.he.net/,Network Tools,Domain & IP Intelligence,,
Router Passwords,https://www.routerpasswords.com/,Network Tools,Domain & IP Intelligence,,
CIRT - Default Passwords,https://cirt.net/passwords,Network Tools,Domain & IP Intelligence,,
Shodan,https://www.shodan.io/,Internet Of Thinks,Domain & IP Intelligence,,
Internet of Things Infographic,https://www.iacpcybercenter.org/resources-2/iot/,Internet Of Thinks,Domain & IP Intelligence,,
Visualsitemapper,http://www.visualsitemapper.com/,Visualization Tools,Uncategorized,,
Nerdy Data,https://www.nerdydata.com/,Technology Lookup / BuiltWith,Uncategorized,,
BuiltWith Technology Lookup,https://builtwith.com/,Technology Lookup / BuiltWith,Uncategorized,,
Wappalyzer - Technology lookup,https://www.wappalyzer.com/,Technology Lookup / BuiltWith,Uncategorized,,
Vulnerability Scanner,https://hackertarget.com/vulnerability-scanner/,Vulnerability and Exploit Search,Uncategorized,,
CVE Details,https://www.cvedetails.com/,Vulnerability and Exploit Search,Uncategorized,,
